{
  "$schema": "../../src/engine/headless-schema.json",
  "meta": {
    "name": "PT-ACT3-FINAL-REVISIONIST",
    "description": "Revisionist Ending (The Revised Draft) - Tests faction gate (revisionist >= 7) enables choice 0 and leads to sc_3_4_901",
    "author": "agent-e",
    "version": "1.0"
  },
  "startingState": {
    "flags": ["mainstage_reached"],
    "inventory": [],
    "stats": {
      "script": 2,
      "stage_presence": 2,
      "improv": 2
    },
    "factions": {
      "revisionist": 7,
      "exiter": 0,
      "preservationist": 0,
      "independent": 0
    },
    "currentScene": "sc_3_4_098"
  },
  "steps": [
    {
      "sequence": 1,
      "action": "checkpoint",
      "description": "Arrived at Last Curtain Call with revisionist >= 7",
      "assertions": {
        "flagsSet": ["mainstage_reached"],
        "currentScene": "sc_3_4_098",
        "choicesAvailable": 5,
        "factions": {
          "revisionist": 7,
          "exiter": 0,
          "preservationist": 0,
          "independent": 0
        }
      }
    },
    {
      "sequence": 2,
      "action": "choose",
      "choiceIndex": 0,
      "description": "Choose 'Take The Editor's powerâ€”Revise the Understage yourself (Revisionist)'",
      "expectedScene": "sc_3_4_901",
      "checkpoint": true,
      "assertions": {
        "flagsSet": ["mainstage_reached", "ending_achieved", "ending_1_revised_draft"],
        "currentScene": "sc_3_4_901"
      }
    }
  ],
  "endingCriteria": {
    "sceneId": "sc_3_4_901",
    "flagsRequired": ["mainstage_reached", "ending_achieved"]
  },
  "softlockDetection": {
    "enabled": true,
    "maxSceneRevisits": 3,
    "failOnDetection": true
  }
}
