{
  "$schema": "../../src/engine/headless-schema.json",
  "meta": {
    "name": "PT-EDGE-001",
    "description": "Empty Inventory Navigation - Tests game is playable with empty inventory (direct path)",
    "author": "agent-e",
    "version": "1.0"
  },
  "startingState": {
    "flags": [],
    "inventory": [],
    "stats": {
      "health": 10,
      "courage": 5,
      "insight": 3
    },
    "currentScene": "sc_1_0_001"
  },
  "steps": [
    {
      "sequence": 1,
      "action": "checkpoint",
      "description": "Verify starting state with empty inventory",
      "assertions": {
        "inventoryExcludes": ["booth_key", "wings_pass"],
        "choicesAvailable": 3
      }
    },
    {
      "sequence": 2,
      "action": "checkpoint",
      "description": "Verify 'Attempt the iron door' is disabled without booth_key",
      "assertions": {
        "inventoryExcludes": ["booth_key"],
        "disabledChoicesValidated": true
      }
    },
    {
      "sequence": 3,
      "action": "choose",
      "choiceIndex": 0,
      "description": "Choose 'Step through the opening to the right' (direct path - no items required)",
      "expectedScene": "sc_1_0_002",
      "checkpoint": true,
      "assertions": {
        "inventoryContains": ["wings_pass"],
        "currentScene": "sc_1_0_002"
      }
    },
    {
      "sequence": 4,
      "action": "choose",
      "choiceIndex": 0,
      "description": "Choose 'Continue toward the light' (reach resolution)",
      "expectedScene": "sc_1_0_900",
      "checkpoint": true,
      "assertions": {
        "currentScene": "sc_1_0_900",
        "inventoryContains": ["wings_pass"]
      }
    }
  ],
  "endingCriteria": {
    "sceneId": "sc_1_0_900",
    "flagsRequired": ["path_direct"],
    "inventoryRequired": ["wings_pass"]
  },
  "softlockDetection": {
    "enabled": true,
    "maxSceneRevisits": 3,
    "failOnDetection": true
  }
}
