{
  "$schema": "../../src/engine/headless-schema.json",
  "meta": {
    "name": "PT-ACT2-H3-REVELATION-ALLIANCE",
    "description": "The Revelation - Tests critical alliance check scene, requires archives_reached flag, validates onEnter effects (revelation_discovered, act2_complete, editor_revealed, alliance_determined, +1 independent faction), and proper gateway to Act 3 Mainstage",
    "author": "agent-e",
    "version": "1.0"
  },
  "startingState": {
    "flags": ["green_room_reached", "archives_reached"],
    "inventory": [],
    "stats": {
      "script": 2,
      "stage_presence": 2,
      "improv": 2
    },
    "factions": {
      "preservationist": 0,
      "revisionist": 0,
      "exiter": 0,
      "independent": 0
    },
    "currentScene": "sc_2_3_001"
  },
  "steps": [
    {
      "sequence": 1,
      "action": "checkpoint",
      "description": "Verify Archives Entry loaded with all exploration choices available",
      "assertions": {
        "flagsSet": ["green_room_reached", "archives_reached", "act2_hub3_started"],
        "currentScene": "sc_2_3_001",
        "choicesAvailable": 5
      }
    },
    {
      "sequence": 2,
      "action": "choose",
      "choiceIndex": 3,
      "description": "Choose 'Approach The Author's Desk (The Revelation)' - navigate to sc_2_3_099",
      "expectedScene": "sc_2_3_099",
      "checkpoint": true,
      "assertions": {
        "flagsSet": ["green_room_reached", "archives_reached", "act2_hub3_started", "revelation_discovered", "act2_complete", "editor_revealed", "alliance_determined"],
        "currentScene": "sc_2_3_099",
        "factions": {
          "independent": 1
        }
      }
    },
    {
      "sequence": 3,
      "action": "choose",
      "choiceIndex": 0,
      "description": "Choose 'Ascend to the Mainstage (Final Act)' - validates gateway to Act 3",
      "expectedScene": "sc_3_4_001",
      "checkpoint": true,
      "assertions": {
        "flagsSet": ["green_room_reached", "archives_reached", "act2_hub3_started", "revelation_discovered", "act2_complete", "editor_revealed", "alliance_determined", "mainstage_ascent"],
        "currentScene": "sc_3_4_001",
        "factions": {
          "independent": 1
        }
      }
    }
  ],
  "endingCriteria": {
    "sceneId": "sc_3_4_001",
    "flagsRequired": ["green_room_reached", "archives_reached", "revelation_discovered", "act2_complete", "editor_revealed", "alliance_determined", "mainstage_ascent"],
    "factionsRequired": {
      "independent": 1
    }
  },
  "softlockDetection": {
    "enabled": true,
    "maxSceneRevisits": 3,
    "failOnDetection": true
  }
}
