{
  "$schema": "../../src/engine/headless-schema.json",
  "meta": {
    "name": "PT-EDGE-002",
    "description": "Minimum Stats Navigation - Tests game is playable with minimum stat values",
    "author": "agent-e",
    "version": "1.0"
  },
  "startingState": {
    "flags": [],
    "inventory": [],
    "stats": {
      "script": 2,
      "stage_presence": 1,
      "script": 2
    },
    "currentScene": "sc_1_0_001"
  },
  "steps": [
    {
      "sequence": 1,
      "action": "checkpoint",
      "description": "Verify starting state with minimum courage (0)",
      "assertions": {
        "stats": { "stage_presence": 1 },
        "choicesAvailable": 3
      }
    },
    {
      "sequence": 2,
      "action": "choose",
      "choiceIndex": 0,
      "description": "Choose 'Step through the opening to the right' (direct path - no stat check required)",
      "expectedScene": "sc_1_0_002",
      "checkpoint": true,
      "assertions": {
        "currentScene": "sc_1_0_002",
        "stats": { "stage_presence": 1 }
      }
    },
    {
      "sequence": 3,
      "action": "choose",
      "choiceIndex": 0,
      "description": "Choose 'Continue toward the light' (reach resolution with minimum stats)",
      "expectedScene": "sc_1_0_900",
      "checkpoint": true,
      "assertions": {
        "currentScene": "sc_1_0_900",
        "stats": { "stage_presence": 1 }
      }
    }
  ],
  "endingCriteria": {
    "sceneId": "sc_1_0_900",
    "flagsRequired": ["path_direct"],
    "inventoryRequired": ["wings_pass"],
    "statsRequired": {
      "stage_presence": 1
    }
  },
  "softlockDetection": {
    "enabled": true,
    "maxSceneRevisits": 3,
    "failOnDetection": true
  }
}
