{
  "$schema": "../../src/engine/headless-schema.json",
  "meta": {
    "name": "PT-ACT3-H4-EMPTY-DESK",
    "description": "The Empty Desk - Tests atmospheric approach scene reachability from Mainstage Descent, requires mainstage_reached flag, validates scene content loads correctly, and return navigation to hub with choicesAvailable assertion",
    "author": "agent-e",
    "version": "1.0"
  },
  "startingState": {
    "flags": ["act2_complete", "mainstage_reached"],
    "inventory": [],
    "stats": {
      "script": 2,
      "stage_presence": 2,
      "improv": 2
    },
    "factions": {
      "preservationist": 0,
      "revisionist": 0,
      "exiter": 0,
      "independent": 0
    },
    "currentScene": "sc_3_4_001"
  },
  "steps": [
    {
      "sequence": 1,
      "action": "checkpoint",
      "description": "Verify Mainstage Descent loaded with all approach choices available",
      "assertions": {
        "flagsSet": ["act2_complete", "mainstage_reached", "act3_started"],
        "currentScene": "sc_3_4_001",
        "choicesAvailable": 4
      }
    },
    {
      "sequence": 2,
      "action": "choose",
      "choiceIndex": 0,
      "description": "Choose 'Approach the desk alone' - navigate to sc_3_4_010 The Empty Desk",
      "expectedScene": "sc_3_4_010",
      "checkpoint": true,
      "assertions": {
        "flagsSet": ["act2_complete", "mainstage_reached", "act3_started"],
        "currentScene": "sc_3_4_010",
        "choicesAvailable": 1
      }
    },
    {
      "sequence": 3,
      "action": "choose",
      "choiceIndex": 0,
      "description": "Return to Mainstage Descent - validates atmospheric scene return navigation",
      "expectedScene": "sc_3_4_001",
      "checkpoint": true,
      "assertions": {
        "flagsSet": ["act2_complete", "mainstage_reached", "act3_started"],
        "currentScene": "sc_3_4_001",
        "choicesAvailable": 4
      }
    }
  ],
  "endingCriteria": {
    "sceneId": "sc_3_4_001",
    "flagsRequired": ["act2_complete", "mainstage_reached", "act3_started"]
  },
  "softlockDetection": {
    "enabled": true,
    "maxSceneRevisits": 3,
    "failOnDetection": true
  }
}
